video_url,user_url,username,title,view_num,created_at,shortdesc,collected_at
/watch?v=HoBoEdlhZsk&pp=ygUJd2F0ZXJzaGVk,/@NorthernCaliforniaPublicMedia,Northern California Public Media,What Is A Watershed?,13K,5 years,"In this story, we learn about the science of watersheds - what they look like, how they are formed, how water flows within them, ...",2026-01-21 23:47:41.848857
/shorts/pSKBa-oUybE,/@BowmansHillWildflowerPreserve,Bowman's Hill Wildflower Preserve,What is a watershed? #nature,24K,2 years,Full video here: https://youtu.be/DB5SEoQpm0Q Find the Preserve online   Website: https://bhwp.org/ Facebook: ...,2026-01-21 23:47:41.850147
/watch?v=U-HDiXm5BVY&list=RDU-HDiXm5BVY&start_radio=1&pp=ygUJd2F0ZXJzaGVkoAcB,/@carterusmmusicvevo4026,CarterUSMMusicVEVO,Carter USM - After The Watershed (Official Music Video),19K,3 years,Follow Chrysalis Records; Subscribe - https://chrys.lnk.to/Subscribe Spotify - https://chrys.lnk.to/SP Facebook ...,2026-01-21 23:47:41.851414
/watch?v=WRIRDfBN5os&list=RDWRIRDfBN5os&start_radio=1&pp=ygUJd2F0ZXJzaGVkoAcB0gcJCYcKAYcqIYzv,/@ExpressoSABC,Expresso Show,Undone | Watershed,471,1 year,Connect With #ExpressoShow Online: Website: http://www.expressoshow.com/ FACEBOOK: ...,2026-01-21 23:47:41.852696
/watch?v=GN3wJmfQc7c&list=RDGN3wJmfQc7c&start_radio=1&pp=ygUJd2F0ZXJzaGVkoAcB,/channel/UCzIi0O2b-T0M2GF0xe_5eEA,Giant Rooks,Giant Rooks feat. Cantus Domus - Watershed (Quarantine Choir),262K,5 years,"Listen to our second album ""How Have You Been?"" here: https://giantrooks.lnk.to/HowHaveYouBeen _____ Website: ...",2026-01-21 23:47:41.854047
/watch?v=mut_T0GcehI&pp=ygUJd2F0ZXJzaGVk,/@jenniStevens,Jenni Stevens,Watershed : Indigo Girls,648K,18 years,Lyrics from the Indigo Girls song Watershed. I just love this song and the meaning behind the words. I took all of these ...,2026-01-21 23:47:41.855457
/watch?v=dUlAANVBYHM&pp=ygUJd2F0ZXJzaGVk,/@vfxdirect,VFX Direct Creative Agency,USDA Watershed Learning Animation - For ASI Communications by VFX Direct,139K,15 years,This is a Animated piece by VFX Direct http:www.vfxdirect.com hired by ASI Communications. The USDA needed an animated ...,2026-01-21 23:47:41.856787
/watch?v=VkYg3OBPzOo&pp=ygUJd2F0ZXJzaGVk,/@amitbhatnagarclasses247,Amit Bhatnagar Classes,What is Watershed?,41K,3 years,Watershed concept and meaning.,2026-01-21 23:47:41.857985
/watch?v=Qny4CDcftrI&pp=ygUJd2F0ZXJzaGVk,/@amillison,Andrew Millison,AMERICA'S BIG MISTAKE: Watershed Democracy REJECTED!,201K,3 years,Permaculture instructor Andrew Millison explains how the USA missed the opportunity in 1878 to create political boundaries ...,2026-01-21 23:47:41.859305
/watch?v=kCkXRHBukVI&list=RDkCkXRHBukVI&start_radio=1&pp=ygUJd2F0ZXJzaGVkoAcB,/channel/UCWe5ZXRJ38R27UwNZPutSEA,Watershed,Watershed - Indigo Girl (Live At The Barnyard Cresta / 2006),9K,2 years,Music video by Watershed performing Indigo Girl (Live At The Barnyard Cresta / 2006). © 2006 EMI Music South Africa (Pty) Ltd ...,2026-01-21 23:47:41.861521
/watch?v=U8zIZWlQsRg&pp=ygUJd2F0ZXJzaGVk,/@fox5atlanta,FOX 5 Atlanta,Deputy watershed commissioner now off the job | FOX 5 News,1.6K,8 months,A Watershed employee is speaking out for the first time about a deputy commissioner in his department who is accused of bullying ...,2026-01-21 23:47:41.863017
/watch?v=KI3DCYeXMfg&list=RDKI3DCYeXMfg&start_radio=1&pp=ygUJd2F0ZXJzaGVkoAcB,/channel/UCWe5ZXRJ38R27UwNZPutSEA,Watershed,Watershed - Down To The Water (Live At The Barnyard Cresta / 2006),684,2 years,Music video by Watershed performing Down To The Water (Live At The Barnyard Cresta / 2006). © 2006 EMI Music South Africa ...,2026-01-21 23:47:50.214278
/watch?v=KQEu9t5ZMVk&pp=ygUJd2F0ZXJzaGVk,/@PaaniFoundation,Paani Foundation,What is Watershed Development? A Film by WOTR (English) (पाणलोट नियोजन म्हणजे नक्की काय?),132K,9 years,8 Principles of Watershed Development: 1. Ridge-to-Valley: Begin from the hill top and move towards the valley bottom. 2. Do it in ...,2026-01-21 23:47:50.216923
/watch?v=pLLvOCphX8k&pp=ygUJd2F0ZXJzaGVk,/@ExpressoSABC,Expresso Show,Watershed Performs “Mountainside”,2.4K,6 years,Watershed have released six studio albums and a greatest hits album. The band has sold in excess of 350 000 albums. Received ...,2026-01-21 23:47:50.218217
/watch?v=GBBRZfIHrOQ&pp=ygUJd2F0ZXJzaGVk,/@TorontoZooChannel,Toronto Zoo,Watershed Wonders,1.4K,5 months,"Did you know that every person, animal, and plant in the world lives in a watershed? The GTA's very own Rouge River Watershed ...",2026-01-21 23:47:50.220804
/shorts/XT__O0BDVSk,/@odishapcswallah,OPSC Wallah,Tuku Tandi | Rank 287 | Watershed Management #OCSTopper2023 #OPSCMockInterview #OPSCOCS2023 #Shorts,15K,3 months,Tuku Tandi | Rank 287 | OCS Topper 2023 #Shorts #OCSTopper2023 #OPSCMockInterview #OPSCOCS2023 #OPSCWallah ...,2026-01-21 23:47:50.222126
/watch?v=yl74j7QAbaw&list=RDyl74j7QAbaw&start_radio=1&pp=ygUJd2F0ZXJzaGVkoAcB,/@TheSilverThumb,Isabeau Van der Eecken,Watershed - Letters with Lyrics,55K,14 years,"This is my first movie, so I hope you enjoy it.",2026-01-21 23:47:50.223910
/watch?v=UsQjOnq_1qA&list=RDUsQjOnq_1qA&start_radio=1&pp=ygUJd2F0ZXJzaGVkoAcB,/@next_music,Next Music,Watershed - Believe (Official Video),10K,5 years,BUY / STREAM and add to your favourite playlists: https://orcd.co/dw3qqqp NEXT MUSIC: ...,2026-01-21 23:47:50.226327
/watch?v=yhsHS1sYfdc&pp=ygUJd2F0ZXJzaGVk,/@WGCUCuriouskids,WGCUCuriouskids,What Is A Watershed?,18K,11 years,Winner of a 2015 NATAS (National Academy of Television Arts & Sciences) Suncoast Chapter EMMY Award. The Director of ...,2026-01-21 23:47:50.230539
/watch?v=oWNhpTfQ9lU&list=RDoWNhpTfQ9lU&start_radio=1&pp=ygUJd2F0ZXJzaGVkoAcB,/@MISCchout,MISCchout,Indigo Girls - Watershed on The Tonight Show 1991,118K,17 years,Beautiful song (with Sara Lee on bass) with interview...Video downloaded from www.lifeblood.net.,2026-01-21 23:47:50.231783
/watch?v=3MUxPn3uKSk&pp=ygUJd2F0ZXJzaGVk0gcJCYcKAYcqIYzv,/@kevinwoodrobotics,Kevin Wood | Robotics & AI,OpenCV Python Watershed Segmentation (Algorithm and Code),15K,2 years,"Get FREE Robotics & AI Resources (Guide, Textbooks, Courses, Resume Template, Code & Discounts) – Sign up via the pop-up ...",2026-01-21 23:47:50.234085
/watch?v=w7Xryn3-i70&pp=ygUJd2F0ZXJzaGVk,/@switchonindia,SwitchON Foundation,Watersheds Explained: Essential Guide to Water Management & Conservation | ENGLISH,1.1K,2 years,"Find out what a watershed is, how it works, and why it's crucial for water management. Learn about the various components of a ...",2026-01-21 23:47:50.235285
/shorts/3XbmKa7rjs4,/@TheFACRP,Fondes Amandes Community Reforestation Project ,Watershed Explained: What They Are & Why They Matter #shorts,978,5 months,Is a watershed just a shed with water? Or is it a complex geographical area where tributaries feed a water basin? Discover the ...,2026-01-21 23:47:50.237618
/watch?v=mGGgtIFbPzc&list=RDmGGgtIFbPzc&start_radio=1&pp=ygUJd2F0ZXJzaGVkoAcB,/@SylviaBilvia,SylviaBilvia,Watershed - Lovely Day.wmv,37K,14 years,"Watershed is a South African Pop-Rock band, which was founded in Johannesburg in 1998.",2026-01-21 23:47:50.238906
/watch?v=UwQDEx5bR5k&list=RDUwQDEx5bR5k&start_radio=1&pp=ygUJd2F0ZXJzaGVkoAcB,/channel/UCWe5ZXRJ38R27UwNZPutSEA,Watershed,Watershed - Yesterday Again (Live At The Barnyard Cresta / 2006),5.1K,2 years,Music video by Watershed performing Yesterday Again (Live At The Barnyard Cresta / 2006). © 2006 EMI Music South Africa (Pty) ...,2026-01-21 23:47:50.240250
/watch?v=Eqog7PqwIdU&pp=ygUJd2F0ZXJzaGVk,/@watershedbristol,Watershed,An Exercise in Perspective || Reuben Armstrong || Watershed,104,Streamed 5 days,"Inspirational and experimental, Reuben Armstrong's latest documentary film follows the story of blind runner / punk singer Phil ...",2026-01-21 23:47:50.242792
