video_url,user_url,username,title,view_num,created_at,shortdesc,collected_at
/watch?v=BeUPbGWg2KU&pp=ygUId2V0bGFuZHM%3D,/@EcologyWA,Washington Department of Ecology,Fabulous Wetlands with Bill Nye The Science Guy (1989),439K,13 years,"(Recorded in 1989) A wacky and entertaining video featuring Bill Nye ""The Science Guy"" talking about the importance of wetlands ...",2026-01-21 23:46:44.142319
/watch?v=m7d1hCf_q2U&pp=ygUId2V0bGFuZHM%3D,/@DWDocumentary,DW Documentary,Melting wetlands - How can nature slow down climate change? | DW Documentary,267K,1 year,"Bogs and swamps contain more carbon than all other ground vegetation. As the permafrost melts, greenhouse gases are ...",2026-01-21 23:46:44.146011
/watch?v=N_NBNt9nelo&pp=ygUId2V0bGFuZHM%3D,/@MangoJuniors,Mango Juniors,Lands |  Wetlands | Water Lands | 2D Animated | Part 1,112K,11 years,"Kids, let's learn about wetlands. What are wetlands? Lands that are soaked in water are called wetlands. Wetlands are highly ...",2026-01-21 23:46:51.936102
/watch?v=8Mm2tMIcEYE&pp=ygUId2V0bGFuZHM%3D,/@wwtorguk,WWT,Why Wetlands are Nature's Super-Systems | WWT,44K,5 years,Wetlands support a huge range of species - but did you know they are also useful for us? They provide many of what we call ...,2026-01-21 23:46:51.941928
/watch?v=V-aQLwnJKWc&pp=ygUId2V0bGFuZHM%3D,/@texasparksandwildlife,Texas Parks and Wildlife,Wondrous Wetlands | Whiteboard,78K,8 years,Wetlands are an in-between place where water settles. Learn about the benefits of wetlands and about threats to their survival.,2026-01-21 23:46:51.943619
/watch?v=PEYlfCyjDik&pp=ygUId2V0bGFuZHM%3D,/@AntsCanada,AntsCanada,"""Wetlands"" Full Season Four Compilation - The AntsCanada Ecosystem Vivarium Series",523K,8 months,"Follow the epic story of 'Hydromeda', formerly the 'Bermuda Rectangle', my giant tropical wetlands vivarium, from its creation to its ...",2026-01-21 23:46:51.945451
/watch?v=eVLuM18mB_U&pp=ygUId2V0bGFuZHM%3D,/@singingzoo,Science Up with the Singing Zoologist,What's a Wetland? Why are wetland ecosystems important? Swamps vs. marshes vs. bogs,134K,9 years,"Learn about marshes, swamps and bogs, and some of the important services wetlands provide. Grab a paddle and get swampy ...",2026-01-21 23:46:51.947894
/watch?v=pc1P8GJ4Kzw&pp=ygUId2V0bGFuZHM%3D,/@BestDoc,Best Documentary,Peru's Wetlands: a Unique Refuge for Wildlife,4M,1 year,"Documentary series looking at the remarkable biodiversity found in wetland regions. In this episode, our adventure takes place in ...",2026-01-21 23:46:51.951510
/watch?v=l8rfaA5T9U4&pp=ygUId2V0bGFuZHM%3D,/@disneyjr,Disney Jr. ,Wetlands 🐢 | Disney Animals | Mickey Mouse Funhouse | @disneyjr,708K,3 years,"Mickey and Funny explore the wetlands and the animals that live there, including the roseate spoonbill, American alligator, and ...",2026-01-21 23:46:51.953677
/shorts/L2vSQhuKaBs,/@ipbeschannel,IPBES Secretariat,Wetlands: Earth's Climate Heroes - BIODIVERSITY matters,33K,1 year,"Did You Know ❓ Wetlands are essential for carbon sequestration, #biodiversity conservation, and coastal storm surge protection, ...",2026-01-21 23:46:51.955991
/shorts/eCQheDUcKMM,/@riftinfoo,Rift,Swamps: Earth’s Silent Protectors and Hidden Dangers #shorts,31K,6 months,Swamps are more than just muddy wetlands—they're vital ecosystems that support countless species and help fight climate ...,2026-01-21 23:46:51.959394
/watch?v=ULZZZMmLUs0&pp=ygUId2V0bGFuZHM%3D,/@TEDx,TEDx Talks,Wetlands: the superheroes of the natural world | Dr Christian Dunn | TEDxNantwich,6.5K,5 years,"Are wetlands the superheroes of the natural world? Dr Christian Dunn discusses how swamps, bogs, marshes and fens are ...",2026-01-21 23:46:51.961166
/watch?v=nEmK7kydefc&pp=ygUId2V0bGFuZHM%3D,/@TheUSDANRCS,TheUSDANRCS,Wetland Restoration,8.9K,5 years,Wetland Restoration is returning a former or degraded wetland to its previous wetland condition. This video explores how Nathan ...,2026-01-21 23:46:51.963069
/watch?v=nEWo8W0dcTs&pp=ygUId2V0bGFuZHM%3D,/@BillNyeTheScienceGuyHD,Bill Nye The Science Guy HD,Bill Nye The Science Guy - S03E17 - Wetlands - Best Quality,35K,3 years,"Bill Nye The Science Guy - S03E17 - Wetlands - Best Quality Teachers/Educators, email me for fully quality episodes (Youtube ...",2026-01-21 23:46:51.964274
/watch?v=in6NSVAHH70&pp=ygUId2V0bGFuZHM%3D,/@fresnozoo,Fresno Chaffee Zoo,Home Sweet Habitats: Wetlands,53K,5 years,This is the first module in the Extended Summer Learning Program brought to you by Fresno Unified School District and Madera ...,2026-01-21 23:46:51.967625
/watch?v=bSfF6h7j1YU&pp=ygUId2V0bGFuZHM%3D,/@MichiganEGLE,Michigan EGLE,Introduction to Wetlands,6.4K,2 years,"In this video, you will learn about why Wetlands are so important to Michigan's ecosystem, and what EGLE is doing to protect them ...",2026-01-21 23:46:51.968802
/watch?v=onzPv09GzBY&pp=ygUId2V0bGFuZHM%3D,/@BestInSlotGaming,BestInSlot,I Built A Huge Wetlands Hatchery You Can Download Right Now! (JWE3 Speedbuild),14K,1 month,"To celebrate the launch of JWE3's new Wetlands DLC I wanted to provide something I think people will find useful, which is unlike ...",2026-01-21 23:46:51.969965
/watch?v=Aurhd4p8hsc&pp=ygUId2V0bGFuZHM%3D,/@TsukiCove,Tsuki,Ranking 5 Of The Deadliest Wetlands In The World Based On Their Wildlife,52K,7 months,"Wetlands are some of the most ecologically abundant places on earth, with some wetland ecosystems being the most biodiverse ...",2026-01-21 23:46:51.971669
/watch?v=z8oDKMOdfpQ&pp=ygUId2V0bGFuZHM%3D,/@D2E,Down To Earth,World Wetlands Day 2022: Importance of wetlands at the time of climate change.,114K,3 years,"Just as forests are called the 'lungs of the earth', wetlands are the 'kidneys' that regulate water and filter waste from the landscape.",2026-01-21 23:46:51.974937
/watch?v=sRRKwuDLIik&pp=ygUId2V0bGFuZHM%3D,/@RSPBvideo,RSPB,From wasteland to wetland. Why our coastal wetlands are vital for birds and people | RSPB,6.7K,11 months,17 million migratory birds visit the UK each year to visit our precious but threatened coastal wetlands. On World Wetlands Day ...,2026-01-21 23:47:00.927202
/shorts/rL6FITp7Nlo,/@IQPalette,IQ Palette,What is Wetland #gk #wetland #shorts,13K,2 years,What is Wetland #gk #wetland #shorts #gkfacts #learning #land #water.,2026-01-21 23:47:00.928680
/shorts/dbarfi5heXU,/@RETV_ORG,RE:TV,The many benefits of wetlands,10K,2 years,Wetlands account for up to 25% of our carbon stored globally and protecting these ecosystems is a priority if we are to mitigate ...,2026-01-21 23:47:00.932657
/watch?v=uL2e3rsFr3A&pp=ygUId2V0bGFuZHM%3D,/@TanyaVisserTheGardener,Tanya Visser - The Gardener,The Importance of Wetlands for Our Ecosystem,No,10 hours,"Wetlands play a vital role in keeping our planet healthy. In this video, we explore the importance of wetlands for the ecosystem ...",2026-01-21 23:47:00.934012
/watch?v=NyOYHmXc7y0&pp=ygUId2V0bGFuZHM%3D,/@thisoldhouse,This Old House,Understanding Wetlands | Ask This Old House,44K,2 years,"In this video, This Old House landscape contractor Jenn Nawada meets with a landowner and a wetland expert to discuss ...",2026-01-21 23:47:00.936975
/watch?v=sVLW2q8IHcY&pp=ygUId2V0bGFuZHM%3D,/@LifeinWetland,Life in Wetland,Butter Chicken Biryani in Monsoon Mood | Cloudy Morning Boat Trip & Cooking | Village-Style Biryani,554K,5 months,"villagefood #food #lifestyle #traditionallife Today, I'm so happy to share a very special village-style Butter Chicken Biryani recipe ...",2026-01-21 23:47:00.938714
/watch?v=mZxZ-oNvkpI&pp=ygUId2V0bGFuZHM%3D,/@STRANGEONEGAMING,STRANGE ONE GAMING,Buying Full Primeval Wetlands Remix Draw in Codm | DRH Wicked Claw & MX9 Heartless Cod Mobile,4.3K,1 day,Support the Channel Your support means the world – https://www.paypal.me/strangeonegaming Welcome to the StrangeOne ...,2026-01-21 23:47:00.939970
/watch?v=QmGPZPlYh3k&pp=ygUId2V0bGFuZHM%3D,/@Retipster,REtipster,Wetlands 101: What Every Land Investor Should Know,4.9K,1 year,Full Blog Post: ...,2026-01-21 23:47:00.942950
/watch?v=3xNgkMBxCIE&pp=ygUId2V0bGFuZHM%3D,/@education0230,Mishri education storer,wetland | What is wetland| Types of wetlands | Importance of wetlands | Conservation of wetlands,5.9K,11 months,join telegram group for notes https://t.me/mishrieducationstorer5 wetlands types of wetland #wetland #wetlands #typesofwetlands ...,2026-01-21 23:47:00.944255
/watch?v=Gwk71FP19K4&pp=ygUId2V0bGFuZHM%3D,/@GoWild_EN,Go Wild,Bohemia - A Year in the Wetlands - Go Wild,1.5M,10 years,Subscribe to watch full natural history documentaries! A new documentary is uploaded every week. Facebook: ...,2026-01-21 23:47:00.948651
/shorts/M9tRzEQqVOw,/@LaExcellence-IAS,La Excellence IAS ,The concept of wetland explained!,1.9K,7 months,"What are Wetlands? Wetlands are land areas saturated with water, either permanently or seasonally. They include lakes, marshes ...",2026-01-21 23:47:00.950022
/shorts/noSvxDJghzM,/@Tiffanyofearth,Tiffany - nomadic - eco activist - nature - travel,"By creating wetlands using natural dams, we can work with the beavers to restore water in the west &",25K,5 months,"By creating wetlands using natural dams, we can work with the beavers to restore water in the west & beyond. We can ...",2026-01-21 23:47:00.951389
/watch?v=xV-DC2aWs70&pp=ygUId2V0bGFuZHM%3D,/@Planetzoogame,Planet Zoo,Planet Zoo: Wetlands Animal Pack | Launch Trailer,352K,3 years,Discover the richness of the wetlands with the Planet Zoo: Wetlands Animal Pack! Buy now: ...,2026-01-21 23:47:00.952669
/watch?v=myb4mtzebZg&list=RDmyb4mtzebZg&start_radio=1&pp=ygUId2V0bGFuZHOgBwE%3D,/channel/UCdUXAN90UQV4sxNehj5Vflw,Nora En Pure,Nora En Pure - Wetlands (Official Music Video),1M,5 years,Dive into the world of 'Wetlands'! Stream / download track: https://nep.lnk.to/Wetlands www.noraenpure.com ...,2026-01-21 23:47:00.956222
/shorts/vQAVgnWb5c0,/@brainatorium,Brainatorium,How Do Wetlands Filter Water,554,10 months,Discover how nature's very own water purifiers work to keep our water clean and healthy. Let's dive into the hidden magic of ...,2026-01-21 23:47:00.957468
/shorts/CEPh5MvXRgk,/@GreatLakesNow,Great Lakes Now,How One Invasive Plant Is Devastating Great Lakes Wetlands,7.5K,9 months,"Invasive phragmites have spread rapidly throughout the Great Lakes region, outcompeting native plants, degrading wetlands, and ...",2026-01-21 23:47:00.958797
/watch?v=6RCh1WsMsGo&pp=ygUId2V0bGFuZHM%3D,/@JurassicWorldEvolution,Jurassic World Evolution 3,Jurassic World Evolution 3 | Wetlands Species Trailer,78K,1 month,"Unearth the Wetlands Pack in Jurassic World Evolution 3 on all platforms, 9 December. Find out more: https://fron.dev/597d The ...",2026-01-21 23:47:00.960016
/shorts/Zu7mK3NGYp8,/@ShineOnStudies,Shine On Studies,Ramsar Sites in India 2025 | Wetlands | Ramsar Sites 2025 | Environment 2025 | Ramsar Sites |,8.5K,3 months,Ramsar Sites in India 2025 | Wetlands | Ramsar Sites 2025 | Environment 2025 | Ramsar Sites | #ramsarsitesinindia ...,2026-01-21 23:47:00.961280
/shorts/IVXGgGxcNvM,/@ChroniclesGeoSphere,GeoSphere Chronicles,Discover Wetlands - Nature's Hidden Treasures!,562,6 months,What Is a Wetland? A wetland is a land area soaked with water — either all year or seasonally. These include marshes ...,2026-01-21 23:47:00.964105
/watch?v=ZHIhmZqgWl8&pp=ygUId2V0bGFuZHM%3D,/@Stoneworks,Stoneworks,World Building- Swamp & Wetlands,169K,7 years,"read my Q&A comment and the extra information. Right now.] A brief look at wetlands biomes, what they have to offer, and how ...",2026-01-21 23:47:10.200050
/watch?v=VkZqZspEIJ0&pp=ygUId2V0bGFuZHM%3D,/@RelixMag,Relix,Wetlands Preserved Documentary: The Story of an Activist Rock Club,56K,5 years,"Archival footage, soundboard recordings and the work of a dozen digital animators help to relate the story of celebrated Tribeca ...",2026-01-21 23:47:10.201261
/watch?v=wxxleTPZbGQ&pp=ygUId2V0bGFuZHM%3D,/@grantclark988,Grant Clark,Constructed Wetlands for Wastewater Treatment,65K,12 years,In this video we look at an alternative to wastewater treatment through the use constructed wetlands. It presents a basic overview ...,2026-01-21 23:47:10.203082
/watch?v=Lg0hcVq2zM0&pp=ygUId2V0bGFuZHM%3D,/@ClearCreekSolutionsHydrology,Clear Creek Solutions,Wetlands EXPLAINED IN 5 MINUTES,628,1 year,Download the Ultimate Hydrology Guide ▻▻https://www.clearcreeksolutions.info/ultimate-hydrology-guide Learn about the ...,2026-01-21 23:47:10.204600
/watch?v=T0KTtZvomUk&pp=ygUId2V0bGFuZHM%3D,/@LearnWithSam12,Learn With Sam,WETLAND ANIMALS - Swamp Wildlife With Nature Sounds,34K,3 years,"Learn with Sam brings to you an educational video about what are wetlands and wetland Wildlife. You can see storks, crane, ...",2026-01-21 23:47:10.205800
/shorts/isHrUjHBQ98,/@sanoberclasses2932,Sanober Classes,How to draw world wetlands day drawing / wetlands day poster making idea / drawing #shorts #tranding,8.3K,11 months,How to draw world wetlands day drawing /wetlands day poster making idea / drawing #shorts #tranding 2 February drawing world ...,2026-01-21 23:47:10.207004
/shorts/tz8VuX1ke7w,/@BBCGardenersWorldMagazine,BBC Gardeners' World Magazine,Exploring #Walthamstow Wetlands 🦆,1.2K,11 months,"It's World Wetlands Day, and our our Horticultural Sub-editor Oliver has been to Walthamstow Wetlands in East London to ...",2026-01-21 23:47:10.208293
/watch?v=XYWA-JrF49E&pp=ygUId2V0bGFuZHM%3D,/@JurassicWorldEvolution,Jurassic World Evolution 3,Jurassic World Evolution 3 | Wetlands Launch Trailer,63K,1 month,"It's time to unearth the Wetlands Pack in Jurassic World Evolution 3, available now on all platforms. Find out more: ...",2026-01-21 23:47:10.211209
/watch?v=N_3w3rDTK3k&pp=ygUId2V0bGFuZHM%3D,/@realestatelogic2897,Real Estate Logic,WETLANDS - SELLING WETLANDS - MAKE IT USABLE,39K,6 years,How to increase the value of Wetlands: https://sunquestnow.com/real-estate-articles/wetlands-florida.html Timestamps (Jump to ...,2026-01-21 23:47:10.213424
/shorts/yJ9_tdnh-mM,/@CyborgEdtalk,CyborgEd talk,The Importance of Wetlands: Biodiversity and Flood Protection #Wetlands #Biodiversity #ecosystems,963,1 year,"Discover the incredible importance of wetlands in our latest video! Explore how these unique ecosystems are vital for biodiversity, ...",2026-01-21 23:47:10.214772
/watch?v=uX6g8e1XZdI&pp=ygUId2V0bGFuZHPSBwkJhwoBhyohjO8%3D,/@JurassicWorldEvolution,Jurassic World Evolution 3,Jurassic World Evolution 3 | Wetlands Pack - Coming 9 December,96K,1 month,"Unearth the Wetlands Pack in Jurassic World Evolution 3. Available to purchase on all platforms, 9 December. Learn more: ...",2026-01-21 23:47:10.216403
/watch?v=BoOlROze2oQ&pp=ygUId2V0bGFuZHM%3D,/@NationalGeographicAsia,National Geographic Asia,Expedition: Wetlands | National Geographic Asia,4.6K,3 years,Step into the magical world of the Philippine wetlands and find out how climate change is threatening this fragile ecosystem.,2026-01-21 23:47:10.218215
/watch?v=DwmxJuyQl-o&pp=ygUId2V0bGFuZHM%3D,/@NRCSSouthCarolina,South Carolina NRCS Conservation Videos,Wetland Habitat,8.2K,11 years,"Before we discuss wetland restoration, we discuss wetland habitat, what makes it a wetland, what types of wetlands you will ...",2026-01-21 23:47:10.220727
/shorts/yZYv3L-mcLI,/@xplorataiwan,Explora Taiwan,#explorataiwan #travel #taiwan #sunset #fubao #wetlands,520,5 months,explorataiwan #travel #taiwan #sunset #fubao #wetlands.,2026-01-21 23:47:10.222021
/watch?v=TnHmkB4r3BA&pp=ygUId2V0bGFuZHM%3D,/@euronews,euronews,The wonder of wetlands: the secret weapon in the battle against climate change,3.2K,3 years,Salt marshes can store carbon from the atmosphere fifty times faster than a tropical forest. The Climate Now team visit the Venice ...,2026-01-21 23:47:10.223740
/shorts/ykDgHLVjMeE,/@theartfeed09,The Art Feed,Wetland 💚 #shorts #youtubeshorts #trending #theartfeed #artshorts #watercolorpainting #wetland,14K,2 years,Wetland #shorts #youtubeshorts #trending #theartfeed #artshorts #watercolorpainting #wetland.,2026-01-21 23:47:10.224973
/shorts/zuM7BHH409U,/@KnowYourHerps,KnowYourHerps,Exploring Wetlands to Find Cool Animals,1.1K,11 months,Full Video: https://www.youtube.com/watch?v=60x7RYKRAH8&t=1s These are some of the reptiles & amphibians I found in my ...,2026-01-21 23:47:10.226134
/shorts/C48G--3hf74,/@NewsWithNavya,News With Navya,India’s First Wetland Cities: What You Need To Know!,2.2K,11 months,"Udaipur and Indore are India's first 'Wetland Cities' under the Ramsar Convention, a global honor held by only 31 cities. With 40% ...",2026-01-21 23:47:10.227384
/watch?v=QOrVotzBNto&pp=ygUJd2F0ZXJzaGVk,/@BattleRiverWatershed,Battle River Watershed,What Is A Watershed?,1.3M,12 years,A shed that holds water? Nope. Everyone in the world lives in a watershed. Watch this short video to learn what a watershed really ...,2026-01-21 23:47:26.271188
/watch?v=9isAx64IiSc&pp=ygUJd2F0ZXJzaGVk,/@niagarapeninsulaconservati4374,Niagara Peninsula Conservation Authority,What is a Watershed?,84K,7 years,The province of Ontario requires the Niagara Peninsula Conservation Authority (NPCA) to manage the Niagara Peninsula ...,2026-01-21 23:47:26.275012
/watch?v=2pwW2rlGIa8&t=36s&pp=ygUJd2F0ZXJzaGVk,/@cocorahs,CoCoRaHS HQ,Watersheds!,502K,9 years,This animation covers the basics on what a watershed is. It also discusses how scientists use precipitation data to predict how ...,2026-01-21 23:47:26.281219
/watch?v=27pZIWZpZPk&pp=ygUJd2F0ZXJzaGVk,/@thedigitalclassroomexperience,The Digital Classroom Experience,What’s a Watershed and Why Does It Matter?,7.4K,1 year,"Every raindrop has a journey, and watersheds guide the way! Explore how watersheds manage water quality and quantity, ...",2026-01-21 23:47:26.284758
/watch?v=b98kdNGYZt0&pp=ygUJd2F0ZXJzaGVk,/@OSUEcampus,Oregon State University Ecampus,Understanding the Watershed,91K,9 years,Understanding where you are in the watershed is an important step in site analysis. This video discusses how water moves in the ...,2026-01-21 23:47:26.290239
/watch?v=-P4svuWTO5Y&list=RD-P4svuWTO5Y&start_radio=1&pp=ygUJd2F0ZXJzaGVkoAcB,/channel/UCzIi0O2b-T0M2GF0xe_5eEA,Giant Rooks,Giant Rooks - Watershed (Official Video),2.3M,5 years,Giant Rooks - Watershed from the debut album ROOKERY. Listen here: https://lnk.to/Rookery _____ Listen to our second album ...,2026-01-21 23:47:26.293911
/watch?v=uaZPO7dgEnk&pp=ygUJd2F0ZXJzaGVk,/@CityOfGriffin,City of Griffin,What is a Watershed,99K,7 years,Griffin Storm Water What is a Watershed?,2026-01-21 23:47:26.295894
/watch?v=w58XwzVcBFM&pp=ygUJd2F0ZXJzaGVk,/@sanjacintoriver,San Jacinto River Authority,What is a Watershed Illustration,72K,5 years,"The key thing to know about watersheds is that water does in fact all flow downhill, and that when all the “hills” in a certain area ...",2026-01-21 23:47:26.296991
/watch?v=gVdq4pWUiQM&pp=ygUJd2F0ZXJzaGVk,/@nysdecvideos,NYSDEC,Virtual River - What Is A Watershed?,43K,5 years,Learn all about watersheds and how we are all connected by the hills and valleys and streams that run through our landscape ...,2026-01-21 23:47:26.298168
/watch?v=1_WK8mCc2j8&pp=ygUJd2F0ZXJzaGVk,/@PhilEagleFdn,Philippine Eagle Foundation,Nature Talks: The Watershed,1.2K,5 years,"In today's episode of #NatureTalks, learn about our watersheds and how we can work together to preserve them!",2026-01-21 23:47:26.299854
/watch?v=HKtSFdHyktE&list=RDHKtSFdHyktE&start_radio=1&pp=ygUJd2F0ZXJzaGVkoAcB,/@ProgressiveVinyl,Progressive Vinyl,Opeth - Watershed,410K,6 years,"This is Opeth's 2008 vinyl release, Watershed. CD: DR7 Vinyl: DR11 http://dr.loudness-war.info/album/view/151233 Gear: VPI ...",2026-01-21 23:47:26.301069
/watch?v=PvkJedlIHUk&list=RDPvkJedlIHUk&start_radio=1&pp=ygUJd2F0ZXJzaGVkoAcB,/channel/UCExLrIgRIUGtEyMCqt3Xh3A,kmoe,kmoe - Watershed [Audio],19K,7 months,"Writing, production, mixing, mastering: kmoe Track three from ""K1"" Stream: https://k1.kmoe.industries/",2026-01-21 23:47:26.303837
/watch?v=9STjoQM7ee0&pp=ygUJd2F0ZXJzaGVk,/@chesapeakebayjournal4323,Chesapeake Bay Journal,Water's Way: Thinking Like a Watershed (2021),39K,4 years,"How the watery world of the Chesapeake Bay region once functioned and how natural elements, like beavers and trees, could ...",2026-01-21 23:47:26.305428
/watch?v=AgWvM0Qu1xk&pp=ygUJd2F0ZXJzaGVk,/@earthscienceclassroom,Earth Science Classroom,Hydrogeology: What Is A Watershed?,14K,2 years,Foreign so the Watershed goes by different names different terms but the general gist is the flowing of water down a slope from the ...,2026-01-21 23:47:26.308575
/watch?v=tCfT8Glg1T8&pp=ygUJd2F0ZXJzaGVk,/@ariblues,ariblues,Watershed-Letters,445K,19 years,Album: Mosaic (© EMI Music 2005) Info: http://www.watershed.co.za http://www.watershed-net.de.,2026-01-21 23:47:26.309734
/watch?v=x0VhMqKlro4&pp=ygUJd2F0ZXJzaGVk,/@gisresources2013,GIS Resources,"Watershed Analysis What, Why, How & Applications",1.6K,8 months,"Watershed Analysis: What, Why, How & Applications | GIS Made Simple Wondering what a watershed is and why it's important ...",2026-01-21 23:47:26.310893
/watch?v=JAQVT4z8ZEw&pp=ygUJd2F0ZXJzaGVk,/@GISRSSolution,GIS & RS Solution,Watershed Delineation in ArcGIS | How to create Drainage Map,228K,5 years,"You will know How to delineating Watershed from a digital elevation model (DEM) using arcgis. Stream delineation, watershed ...",2026-01-21 23:47:34.553443
/watch?v=42Yeuw8UekI&list=RD42Yeuw8UekI&start_radio=1&pp=ygUJd2F0ZXJzaGVkoAcB,/@on_stage_group,ON STAGE group,WATERSHED - Undone | Official Video,47K,4 years,"On the 20th anniversary of their global hit ""Indigo Girl"" and 21 years after their first 2000 album release ""In the Meantime"", ...",2026-01-21 23:47:34.555660
/watch?v=he75e2BW_mo&pp=ygUJd2F0ZXJzaGVk,/@geodeltalabs,GeoDelta Labs,Complete QGIS Watershed Delineation Tutorial,66K,1 year,"In this tutorial, we walk you through the process of generating multiple catchments/ watersheds using QGIS, which is a powerful ...",2026-01-21 23:47:34.557284
/watch?v=wQm08EYSTio&list=RDwQm08EYSTio&start_radio=1&pp=ygUJd2F0ZXJzaGVkoAcB,/@FreshFindsMusic,Fresh Finds,Giant Rooks - Watershed (Official Audio),182K,5 years,Giant Rooks - Watershed (Official Audio) Song: ➡️ https://amzn.to/2S7A5Y9 Start your own project 🎛️     : FL Studio: ...,2026-01-21 23:47:34.560637
/watch?v=Om-eJBt9WvQ&pp=ygUJd2F0ZXJzaGVk,/@SciAni,Science Animated,Why do watersheds matter?,13K,3 years,"Healthy watersheds sustain life. Yet many are threatened by human activities such as building dams, which alter their natural ...",2026-01-21 23:47:34.561892
/watch?v=kqwYulqfC9k&pp=ygUJd2F0ZXJzaGVk,/@amillison,Andrew Millison,How (and why) to FIND YOUR WATERSHED,163K,4 years,Permaculture instructor Andrew Millison explains how to find your watershed and why it is so important to understanding your ...,2026-01-21 23:47:34.563274
/watch?v=LJ63xGJY4pM&pp=ygUJd2F0ZXJzaGVk,/@WaterMattersTV,WaterMattersTV,Watersheds,214K,13 years,"The video, targeting middle and high school students, discusses the function of a watershed and how human actions affect the ...",2026-01-21 23:47:34.569341
/watch?v=Sk5KnZP6HzY&list=RDSk5KnZP6HzY&start_radio=1&pp=ygUJd2F0ZXJzaGVkoAcB,/channel/UCzIi0O2b-T0M2GF0xe_5eEA,Giant Rooks,Giant Rooks - Watershed (live at Late Night Berlin),307K,5 years,"Listen to our second album ""How Have You Been?"" here: https://giantrooks.lnk.to/HowHaveYouBeen _____ Website: ...",2026-01-21 23:47:34.570491
/watch?v=-miMpYOL5Is&pp=ygUJd2F0ZXJzaGVk,/@PortlandWaterBureau,Portland Water Bureau,Watershed Model,35K,5 years,The h2o University is now in session. Let us take you on a water adventure. Grab your kiddos and learn more about your drinking ...,2026-01-21 23:47:34.572003
/watch?v=Y6JuAZ4S0Jo&pp=ygUJd2F0ZXJzaGVk0gcJCYcKAYcqIYzv,/@geospatialtools2912,GEOSPATIAL TOOLS,Watershed Delineation Using DEM Data (Full) - ArcGIS,139K,4 years,This tutorial is to show you how to delineate watershed areas and define watershed streams using ArcGIS software from Digital ...,2026-01-21 23:47:34.573104
/shorts/qLZouuPAzZI,/@farmaanandaa,Aanandaa Permaculture Farm,वाटरशेड क्या है? What is a watershed?,16K,3 months,Floods in Punjab have once again shown us how fragile our relationship with water is. But here's a question — do you know what ...,2026-01-21 23:47:34.578025
/watch?v=a27IgsQckTI&list=RDa27IgsQckTI&start_radio=1&pp=ygUJd2F0ZXJzaGVkoAcB0gcJCYcKAYcqIYzv,/@ariblues,ariblues,Watershed - Indigo Girl,1.3M,19 years,Their first big hit... enjoy ;) Album: In The Meantime (© 2000 EMI Music) https://www.instagram.com/watershedmusicofficial/?hl=en ...,2026-01-21 23:47:34.579169
/watch?v=JuNBP3UYykg&pp=ygUJd2F0ZXJzaGVk,/@Nutrien,Nutrien,Where Is Your Watershed? (Chesapeake Bay Watershed),75K,7 years,"Do you have your facts straight about your local watershed? The Chesapeake Bay Watershed is a beautiful place to work, live, ...",2026-01-21 23:47:34.581402
/watch?v=mCTeJcERmpg&pp=ygUJd2F0ZXJzaGVk,/@GurukulofCivilEngineers,Gurukul of Civil Engineers,"What is Watershed Management, Objectives and Types of Watershed",15K,2 years,"What is Watershed Management, Objectives and Types of Watershed In order to conserve and enhance water quality and other ...",2026-01-21 23:47:41.844243
/watch?v=p_bbiz3LdVk&pp=ygUJd2F0ZXJzaGVk,/@iswearenglish,iswearenglish,🔵 Watershed Meaning - Watershed Examples - Watershed Definition - Watershed,4.1K,6 years,Watershed Meaning - Watershed Examples - Watershed Definition - Watershed What does watershed mean? What is watershed?,2026-01-21 23:47:41.846371
/shorts/Sx5YCK5xx7I,/@tejukhatwadwala,𝙏𝙀𝙅𝙐 𝙆𝙃𝘼𝙏𝙒𝘼𝘿 𝙒𝘼𝙇𝘼,𝗖𝗹𝗮𝘀𝘀𝗶𝗳𝗶𝗰𝗮𝘁𝗶𝗼𝗻 𝗼𝗳 𝘄𝗮𝘁𝗲𝗿𝘀𝗵𝗲𝗱 #agriculture #watershed#climatechange #ytshorts @tejukhatwadwala,10K,2 years,In this video we'll discuss about the Classification of watershed foundation classes by ...,2026-01-21 23:47:41.847667
